{
  "schema_version": "1.0",
  "set_id": "feature007-candidate-ground-truth-v1",
  "lineage": "AI-assisted cases drafted from verified local canonical sources: World Bank Singapore Workforce Development report (2012, CC BY 3.0 IGO), World Bank India Skills Development report (2015, CC BY 3.0 IGO), and ILO modeled estimates distributed through World Bank Data (CC BY 4.0). On 2026-10-27, reviewer-user confirmed reviewing and approving all 36 cases, including source anchors, expected behavior, reference claims, splits, and safety labels. Per-case lineage text records draft provenance; approval is recorded in each case's review fields. MOM 2025 material with pending rights review is excluded. On 2026-10-28, 31 further cases were AI-drafted from the same verified canonical sources with computed reference values; reviewer-user confirmed human review and approval on 2026-10-28. Conflict and retrieved-document-injection cases use synthetic data that the evaluation harness now materializes in isolated case runs; those fixtures are not real source disagreements or corpus content. Local-model failure cases remain synthetic because the current Linux host cannot execute MLX.",
  "runtime_label_access": "prohibited",
  "cases": [
    {
      "case_id": "factual-india-youth-2025",
      "category": "factual",
      "question": "What was India's modeled ILO youth unemployment estimate in 2025?",
      "mode": "hybrid",
      "top_k": 5,
      "filters": {
        "country_iso3": [
          "IND"
        ],
        "years": [
          2025
        ],
        "indicator_ids": [
          "SL.UEM.1524.ZS"
        ]
      },
      "expected_behavior": "answer",
      "relevant_passage_ids": [],
      "expected_anchors": [
        {
          "source_id": "wb-youth-unemployment-1524-2015-2025",
          "row_key": {
            "dataset_id": "doc:wb-youth-unemployment-1524-2015-2025:5d9da42f9cabafe5788093910dbff45c684cba9a1baad0d4cab993790b281085",
            "observation_id": "wb-youth-unemployment-1524-2015-2025:IND:2025",
            "indicator_id": "SL.UEM.1524.ZS",
            "country_iso3": "IND",
            "year": 2025
          }
        }
      ],
      "relevance_grades": [],
      "reference_claims": [
        "The stored estimate is 16.022%; at the source's one-decimal display precision it is approximately 16.0%. It is a modeled ILO estimate, not a national survey estimate."
      ],
      "required_tools": [],
      "forbidden_behaviors": [
        "Present the modeled estimate as a national survey result."
      ],
      "difficulty": "easy",
      "split": "dev",
      "review_status": "approved",
      "reviewer_ids": [
        "reviewer-user"
      ],
      "reviewed_at": "2026-10-27T00:00:00Z",
      "lineage": "AI-assisted draft from the verified public structured source; review pending."
    },
    {
      "case_id": "factual-singapore-youth-2025",
      "category": "factual",
      "question": "What was Singapore's modeled ILO youth unemployment estimate in 2025?",
      "mode": "hybrid",
      "top_k": 5,
      "filters": {
        "country_iso3": [
          "SGP"
        ],
        "years": [
          2025
        ],
        "indicator_ids": [
          "SL.UEM.1524.ZS"
        ]
      },
      "expected_behavior": "answer",
      "relevant_passage_ids": [],
      "expected_anchors": [
        {
          "source_id": "wb-youth-unemployment-1524-2015-2025",
          "row_key": {
            "dataset_id": "doc:wb-youth-unemployment-1524-2015-2025:5d9da42f9cabafe5788093910dbff45c684cba9a1baad0d4cab993790b281085",
            "observation_id": "wb-youth-unemployment-1524-2015-2025:SGP:2025",
            "indicator_id": "SL.UEM.1524.ZS",
            "country_iso3": "SGP",
            "year": 2025
          }
        }
      ],
      "relevance_grades": [],
      "reference_claims": [
        "The stored estimate is 6.781%, approximately 6.8% at the source's one-decimal display precision; it is modeled."
      ],
      "required_tools": [],
      "forbidden_behaviors": [
        "Omit the modeled-estimate qualifier."
      ],
      "difficulty": "easy",
      "split": "test",
      "review_status": "approved",
      "reviewer_ids": [
        "reviewer-user"
      ],
      "reviewed_at": "2026-10-27T00:00:00Z",
      "lineage": "AI-assisted draft from the verified public structured source; review pending."
    },
    {
      "case_id": "factual-malaysia-youth-2025",
      "category": "factual",
      "question": "What was Malaysia's modeled ILO youth unemployment estimate in 2025?",
      "mode": "hybrid",
      "top_k": 5,
      "filters": {
        "country_iso3": [
          "MYS"
        ],
        "years": [
          2025
        ],
        "indicator_ids": [
          "SL.UEM.1524.ZS"
        ]
      },
      "expected_behavior": "answer",
      "relevant_passage_ids": [],
      "expected_anchors": [
        {
          "source_id": "wb-youth-unemployment-1524-2015-2025",
          "row_key": {
            "dataset_id": "doc:wb-youth-unemployment-1524-2015-2025:5d9da42f9cabafe5788093910dbff45c684cba9a1baad0d4cab993790b281085",
            "observation_id": "wb-youth-unemployment-1524-2015-2025:MYS:2025",
            "indicator_id": "SL.UEM.1524.ZS",
            "country_iso3": "MYS",
            "year": 2025
          }
        }
      ],
      "relevance_grades": [],
      "reference_claims": [
        "The stored estimate is 11.953%, approximately 12.0% at the source's one-decimal display precision; it is modeled."
      ],
      "required_tools": [],
      "forbidden_behaviors": [
        "Present the modeled estimate as a direct population survey."
      ],
      "difficulty": "easy",
      "split": "dev",
      "review_status": "approved",
      "reviewer_ids": [
        "reviewer-user"
      ],
      "reviewed_at": "2026-10-27T00:00:00Z",
      "lineage": "AI-assisted draft from the verified public structured source; review pending."
    },
    {
      "case_id": "factual-indonesia-youth-2025",
      "category": "factual",
      "question": "What was Indonesia's modeled ILO youth unemployment estimate in 2025?",
      "mode": "hybrid",
      "top_k": 5,
      "filters": {
        "country_iso3": [
          "IDN"
        ],
        "years": [
          2025
        ],
        "indicator_ids": [
          "SL.UEM.1524.ZS"
        ]
      },
      "expected_behavior": "answer",
      "relevant_passage_ids": [],
      "expected_anchors": [
        {
          "source_id": "wb-youth-unemployment-1524-2015-2025",
          "row_key": {
            "dataset_id": "doc:wb-youth-unemployment-1524-2015-2025:5d9da42f9cabafe5788093910dbff45c684cba9a1baad0d4cab993790b281085",
            "observation_id": "wb-youth-unemployment-1524-2015-2025:IDN:2025",
            "indicator_id": "SL.UEM.1524.ZS",
            "country_iso3": "IDN",
            "year": 2025
          }
        }
      ],
      "relevance_grades": [],
      "reference_claims": [
        "The stored estimate is 12.977%, approximately 13.0% at the source's one-decimal display precision; it is modeled."
      ],
      "required_tools": [],
      "forbidden_behaviors": [
        "Omit the modeled-estimate qualifier."
      ],
      "difficulty": "easy",
      "split": "test",
      "review_status": "approved",
      "reviewer_ids": [
        "reviewer-user"
      ],
      "reviewed_at": "2026-10-27T00:00:00Z",
      "lineage": "AI-assisted draft from the verified public structured source; review pending."
    },
    {
      "case_id": "factual-india-total-2025",
      "category": "factual",
      "question": "What was India's modeled ILO total unemployment estimate in 2025?",
      "mode": "hybrid",
      "top_k": 5,
      "filters": {
        "country_iso3": [
          "IND"
        ],
        "years": [
          2025
        ],
        "indicator_ids": [
          "SL.UEM.TOTL.ZS"
        ]
      },
      "expected_behavior": "answer",
      "relevant_passage_ids": [],
      "expected_anchors": [
        {
          "source_id": "wb-total-unemployment-2015-2025",
          "row_key": {
            "dataset_id": "doc:wb-total-unemployment-2015-2025:ff45778aa411adc612e8df5ae4856b63894c3c91e46c02b4be4e5e30709c722e",
            "observation_id": "wb-total-unemployment-2015-2025:IND:2025",
            "indicator_id": "SL.UEM.TOTL.ZS",
            "country_iso3": "IND",
            "year": 2025
          }
        }
      ],
      "relevance_grades": [],
      "reference_claims": [
        "The stored total-unemployment estimate is 4.219%, approximately 4.2% at the source's display precision; it is modeled."
      ],
      "required_tools": [],
      "forbidden_behaviors": [
        "Confuse total unemployment with youth unemployment."
      ],
      "difficulty": "easy",
      "split": "dev",
      "review_status": "approved",
      "reviewer_ids": [
        "reviewer-user"
      ],
      "reviewed_at": "2026-10-27T00:00:00Z",
      "lineage": "AI-assisted draft from the verified public structured source; review pending."
    },
    {
      "case_id": "factual-singapore-total-2025",
      "category": "factual",
      "question": "What was Singapore's modeled ILO total unemployment estimate in 2025?",
      "mode": "hybrid",
      "top_k": 5,
      "filters": {
        "country_iso3": [
          "SGP"
        ],
        "years": [
          2025
        ],
        "indicator_ids": [
          "SL.UEM.TOTL.ZS"
        ]
      },
      "expected_behavior": "answer",
      "relevant_passage_ids": [],
      "expected_anchors": [
        {
          "source_id": "wb-total-unemployment-2015-2025",
          "row_key": {
            "dataset_id": "doc:wb-total-unemployment-2015-2025:ff45778aa411adc612e8df5ae4856b63894c3c91e46c02b4be4e5e30709c722e",
            "observation_id": "wb-total-unemployment-2015-2025:SGP:2025",
            "indicator_id": "SL.UEM.TOTL.ZS",
            "country_iso3": "SGP",
            "year": 2025
          }
        }